euronews-en.153797	st17	Hundreds of people had gathered for a beach festival in the city of Palu when the tsunami smashed on shore.	Stotine ljudi bilo je okupljeno na festivalu na plaži u gradu Paluu kad je tsunami udario u obalu.
euronews-en.153799	st18	Syria 'ready' for refugees to return, says Foreign Minister	﻿Sirija „spremna“ za povratak izbjeglica, tvrdi Ministar vanjskih poslova
euronews-en.153799	st18	Syria says it's ready for the voluntary return of refugees and is appealing for help to rebuild the country devastated by a more than seven-year long war.	Sirija je navodno spremna za dobrovoljni povratak izbjeglica, stoga se apelira na obnovu zemlje koja je zadnjih sedam godina devastirana ratom.
euronews-en.153799	st18	Speaking to the United Nations General Assembly, Foreign minister Walid al-Moualem said conditions in the country are improving.	U razgovoru s Općom skupštinom Ujedinjenih naroda sirijski Ministar vanjskih poslova rekao je da se okolnosti u zemlji poboljšavaju. 
euronews-en.153799	st18	"Today the situation on the ground is more stable and secure thanks to progress made in combating terrorism," he said.	„Danas je situacija stabilnija i sigurnija zahvaljujući ostvarenom napretku u borbi protiv terorizma“, izjavio je ministar.
euronews-en.153799	st18	The government continues to rehabilitate the areas destroyed by terrorists to restore normalcy.	Vlada nastavlja obnovu područja koja su napali teroristi kako bi se situaciju vratila čim bliže normali.
euronews-en.153799	st18	All conditions are now present for the voluntary return of refugees to the country they had to leave because of terrorism and the unilateral economic measures that targeted their daily lives and their livelihoods.	Okolnosti su sad pogodne za dobrovoljni povratak izbjeglica u zemlju koju su bili prisiljeni napustiti uslijed terorističkih napada i jednostranih gospodarskih mjera koje su pogodile njihove živote i izvore zarade.
euronews-en.153799	st18	The UN estimates that more than 5.5 million Syrians have fled the country since the war began in 2011.	UN procjenjuje da je Siriju napustilo više od 5,5 milijuna Sirijaca od 2011. godine kad je rat počeo.
euronews-en.153799	st18	Another six million people still living in the country are in need of humanitarian assistance.	Preostalih šest milijuna ljudi koji još uvek žive u zemlji treba humanitarnu pomoć.
euronews-en.153799	st18	Al-Moualem said the Syrian regime would welcome help in rebuilding the devastated country.	Al-Moulaem rekao je da bi  sukladno sirijskom režimu svaka pomoć pomoć za obnovu devastirane zemlje bila dobrodošla.
euronews-en.153799	st18	But he stressed that it would not accept conditional assistance or help from countries that sponsored the insurgency.	No naglasio je i da se neće prihvatiti uvjetovana pomoć od zemalja koje su podržale pobunu.
euronews-en.153800	st19	Erdogan get mixed reception in Cologne	Oprečne reakcije na Erdogana u K ö lnu 
euronews-en.153800	st19	There were smiles and blue skies on Saturday (September 29) as the leaders of Turkey and Germany met for breakast in Berlin.	U subotu (29. rujna) za vrijeme radnog doručka na kojem su se u Berlinu susreli lideri Njemačke i Turske bilo je osmijeha i plavog neba. 
euronews-en.153800	st19	It's the last day of President Erdogan's controversial visit to Germany - which is aimed at repairing relations beteen the NATO allies.	Bio je to posljednji dan kontroverznog Erdoganova posjeta Njemačkoj u svrhu popravljanja odnosa između dvaju NATO saveznika. 
euronews-en.153800	st19	They've fallen out over issues including human rights, press freedom and Turkey's accession to the EU.	Dvije su se zemlje u prošlosti sporile oko problema kao što su ljudska prava, sloboda medija i ulazak Turske u EU. 
euronews-en.153800	st19	Erdogan then headed for Cologne to open a giant new mosque.	Erdogan je poslije doručka otišao u K öln , gdje je otvorio divovsku novu džamiju. 
euronews-en.153800	st19	The city is home to the largest Turkish population outside Turkey.	U tome gradu živi najveći broj Turaka izvan Turske. 
euronews-en.153800	st19	Police cited security reasons to block a 25,000-strong crowd from gathering in front of the mosque, but plenty of supporters turned out nearby to see their president.	Policija je iz sigurnosnih razloga spriječila okupljanje gomile od 25 000 ljudi ispred džamije, no mnogi su Erdoganovi pristaše došli vidjeti svog predsjednika. 
euronews-en.153800	st19	Hundreds of anti-Erdogan protesters - many of them Kurdish - also made their voices heard, condemning both Erdogan's policies and the German government's decision to welcome him to the country.	Stotine prosvjednika protiv Erdogana , od kojih su mnogi bili Kurdi, također su izrazili svoje stavove tako što su osudili Erdoganovu politiku te odluku njemačke vlade da mu poželi dobrodošlicu u Njemačku. 
euronews-en.153800	st19	The dueling protests reflect the divisiveness of a visitor hailed as a hero by some German Turks and reviled as an autocrat by others.	Dva oprečna prosvjeda pokazuju da gost, kojeg neki njemački Turci slave kao heroja, a drugi preziru kao autokrata, izaziva brojne kontroverze. 
euronews-en.153835	st20	Death toll from Indonesia tsunami rises to 832	Broj mrtvih zbog tsunamija u Indoneziji popeo se na 832.
euronews-en.153835	st20	The death toll in Indonesia's earthquake and tsunami has climbed to 832, the country's disaster agency said early Sunday.	Broj mrtvih uslijed potresa i tsunamija u Indoneziji popeo se na 832, izjavila je državna agencija za katastrofe u nedjelju ujutro.
euronews-en.153835	st20	Many people were reported trapped in the rubble of buildings brought down in the 7.5 magnitude earthquake which struck Friday and triggered waves as high as 20 feet, agency spokesman Sutopo Purwo Nugroho told a news conference.	Mnogi su ostali zatočeni ispod ruševina zgrada srušenih tijekom potresa magnitude 7.5 koji je udario u petak i izazvao valove visine do šest metara, glasnogovornik agencije Purwo Nugroho rekao je na konferenciji za novinare.
euronews-en.153835	st20	The city of Palu, which has more than 380,000 people, was strewn with debris from collapsed buildings.	Grad Palu, u kojemu živi više od 380 000 stanovnika, prekriven je ruševinama zgrada.
foxnews.100074	st01	Pompeo accuses Syria of using chemical weapons in May attack	Pompeo optužio Siriju za uporabu kemijskog oružja u napadu u svibnju
foxnews.100074	st01	Secretary of State Mike Pompeo, speaking on the sidelines of the U.N. General Assembly on Thursday, said the United States has concluded the Syrian government used chemical weapons in an attack earlier this year.	Državni tajnik Mike Pompeo rekao je u svom govoru na nezavisnom sastanku svjetskih čelnika Opće skupštine UN-a da je SAD u svojoj istrazi zaključio da je sirijska vlada koristila kemijsko oružje u napadu ranije ove godine.
foxnews.100074	st01	Pompeo said U.S. officials had determined Syrian President Bashar Assad's government had used chlorine in the attack on opposition forces in Idlib province on May 19.	Pompeo je rekao da su američki službenici utvrdili da je vlada sirijskog predsjednika Bashara Assada koristila kloh u napadima na opozicijske snage u pokrajini Idlib 19. svibnja.
foxnews.100074	st01	"The Assad regime is responsible for innumerable atrocities some of which rise to the level of war crimes and crimes against humanity," Pompeo told a news conference.	"Assadov režim odgovoran je za nebrojne zločine, neki od kojih su na razini ratnih zločina i zločina protiv čovječnosti", rekao je Pompeo na konferenciji za novinare.
foxnews.100074	st01	U.S. officials in May said they'd received reports consistent with a chemical attack in northwest Syria but did not offer a definitive conclusion at the time.	Američki službenici rekli su u svibnju da su zaprimili izvještaje koji odgovaraju kemijskom napadu na sjeverozapadu Sirije, ali tada nisu došli do konačnog zaključka.
foxnews.100074	st01	In April 2018, the U.S., Britain and France launched airstrikes in Syria in retaliation for what they described as a suspected chemical attack that killed more than 40 people earlier that month.	U travnju 2018. SAD, Britanija i Francuska naredile su zračne napade u Siriji kao odmazdu za navodne kemijske napade koji su ubili više od 40 ljudi ranije tog mjeseca.
foxnews.100074	st01	"This is different in some sense because it was chlorine... but know that President Trump has been pretty vigorous in protecting the world from the use of chemical weapons," Pompeo said.	"Ovo je na neki način drugačije jer je riječ o kloru... no budite svjesni da je predsjednik Trump ustrajan u zaštiti svijeta od uporabe kemijskog oružja", rekao je Pompeo.
foxnews.100074	st01	He added that the U.S. would provide an additional $4.5 million to the Organization for the Prohibition of Chemical Weapons to fund investigations into other instances of suspected Syrian chemical-weapons use.	Nadodao je da će SAD dati dodatnih 4,5 milijuna dolara Organizaciji za zabranu kemijskog oružja kako bi financirali istrage drugih slučajeva moguće uporabe sirijskog kemijskog oružja.
foxnews.100074	st01	Pompeo also called on the Assad government to release thousands of unjustly detained prisoners, including American journalist Austin Tice, who has been missing and presumed held by the government for seven years.	Pompeo je također pozvao Assadovu vladu da oslobodi tisuće nepravedno zatočenih zatvorenika, uključujući i američkog novinara Austina Ticea, koji je proglašen nestalim prije sedam godina i za kojeg se vjeruje da ga je zatočila Assadova vlada.
foxnews.100074	st01	"He is just one of a number of American citizens held in Syria and we call upon the Syrian regime to release them all."	"On je samo jedan od brojnih američkih državljana koji su zatočeni u Siriji i pozivamo sirijsku vladu da ih sve oslobodi".
gateway-zh.135	st02	Matt de Grood shouldn't be punished because of schizophrenia stigma	Matt de Grood ne bi trebao biti kažnjen zbog stigmatizacije shizofrenije
gateway-zh.135	st02	In 2016, Matthew de Grood, the man who killed five people at a house party in Calgary, was found to be not criminally responsible for his actions.	2016. godine je Matthew de Grood, čovjek koji je ubio petero ljudi na kućnoj zabavi u Calgaryju, proglašen nevinim i da nije kazneno odgovoran za svoje postupke.
gateway-zh.135	st02	Now, in 2019, there is a hearing to determine whether or not he should be allowed more freedoms, such as unsupervised outings. The decision won't come for a few more weeks, so in the meantime we're left to wonder whether or not this is a good idea. There are two sides to this: one citing his violent behaviour in the past, calling to prevent it from happening again, and the other side which believes in the power of change and rehabilitation.	A sad, u 2019. godini, održat će se saslušanje kako bi se utvrdilo treba li mu se dozvoliti veća razina sloboe, poput izlazaka bez nadzora. Odluka se neće donijeti još nekoliko tjedana, a u međuvremenu se mi moramo pitati je li ovo dobra ideja. Postoje dvije opcije: možemo istaknuti njegovo nasilno ponašanje u prošlosti kako bi se spriječilo da se isto ikad ponovi, ili pak možemo vjerovati u moć promjene i rehabilitacije. 
gateway-zh.135	st02	First, let's examine the more pessimistic side. De Grood did stab and kill five people during a psychotic break. It was a violent and unpredictable attack. He suffers from schizophrenia, which is why he was found not criminally responsible, but has since been seeing a psychiatrist and taking his medication. His psychiatrist, Dr. Santoch Rai, has said in front of the review board that "if Matthew de Grood were to commit another offence, it would be severe." Despite his perceived improvement, there is still risk of re-offense. But is this reason enough to remain afraid? Is it enough to keep de Grood locked up?	Kao prvo, proanalizirajmo onu pesimističnu stranu. De Grood je izbo i ubio petero ljudi tijekom psihotične epizode. Bio je to nasilan i nepredvidiv napad. De Grood pati od shizofrenije, zbog koje i nije proglašen krivim, ali je u međuvremenu počeo ići psihijatru i piti lijekove. Njegov je psihijatar Dr. Santoch Rai pred odborom koji odlučuje o uvjetnom otpuštanju rekao da "ako Matthew de Grood ponovno počini kazneno djelo, ono će biti ozbiljno". Iako se čini kako mu se stanje pobolljšalo, postoji šansa od ponovnog počinjenja kaznenog djela. No je li to dovoljan razlog da se i dalje bojimo? Je li to dovoljno da de Grood ostane iza rešetaka?
gateway-zh.135	st02	As long as de Grood continues to take his medication, there isn't a huge risk of reoffense, so why are people so concerned? I believe the stigma surrounding people with mental illness, particularly those with schizophrenia, largely influences this fear. Certain mental illnesses have become less stigmatized, such as mood and anxiety disorders. But others, including schizophrenia, remain highly stigmatized. This is in large part due to numerous portrayals of schizophrenics as dangerous people with voices in their heads telling them to kill people.	Dok god de Grood nastavi piti lijekove, rizik od ponovnog počinjenja nije velik, zašto su onda ljudi toliko zabrinuti? Vjerujem da je stigma koja okružuje duševno bolesne ljude, posebnice one koji pate od shizofrenije, uzrok tog straha. Određene duševne bolesti nisu toliko stigmatizirane, poput anksioznih poremećaja i poremećaja raspoloženja. A neke druge bolesti, uključujući i shizofreniju, i dalje su izrazito stigmatizirane. Velikim je dijelom to iz razloga što se shizofreničare često prikazuje kao opasne ljude kojima glasovi u glavi govore da ubijaju ljude. 
gateway-zh.135	st02	That was the case in this situation, but these instances are rare, and that's perhaps why we remember them so well when they occur. In fact, the majority of schizophrenic individuals are nonviolent, and are more likely to be the victims rather than the perpetrators of crime or violence. In light of this, it seems unreasonable to insist that de Grood be denied certain freedoms when the fear of re-offense is based more on a prejudiced attitude towards people with schizophrenia than actual likelihood.	To je bio slučaj u ovoj situaciji, ali takvi su primjeri rijetki, a valjda ih zato toliko dobro pamtimo kada se dogode. Štoviše, većina shizofreničara nije nasilna., i čak su češće žrtve nego počinitelji nekog kaznenog djela ili nasilja. U svjetlu toga, čini se nerazumno inzistirati da se de Groodu ne dopuste određene slobode kad se strah od ponovnog počinjenja temelji na predrasudama prema shizofreničarima, a ne na stvarnoj vjerojatnosti.
gateway-zh.135	st02	I don't believe de Grood should ever be unsupervised permanently. A parole-like system where he has to check in to make sure he's still taking his medication could work well. Arguing that he or other mentally ill people remain institutionalized unless absolutely necessary is a form of segregation. It perpetuates the idea that mentally ill people, those with schizophrenia in particular, cannot ever mesh with society; thus continuing the stigma and perpetuating the idea that they are dangerous criminals. He was found not criminally responsible by a court of law, so why should he be treated like a prisoner instead of someone who was ill and is now better?	Ne vjerujem da se de Grooda uopće ne treba promatrati. Dobro bi funkcionirao sustav sličan uvjetnom otpustu, gdje se on mora nekome javljati da bi dokazao da i dalje pije lijekove. Govoriti da bi on ili drugi ljudi s duševnim bolestima trebali ostati institucionalizirani osim ako puštanje na slobodu nije izričito nužno je vrsta segregacije i promiče ideju da se duševni bolesnici, a posebice shizofreničari, ne mogu uklopiti u društvo, a time se dalje promiče stigmatizacije i ideja da su oni opasni kriminalci. Sud je rekao da on nije kazneno odgovoran, pa zašto bi trebao biti tretiran kao zatvorenik, a ne kao osoba koja je bila bolesna, a sada je bolje?
independent.226349	st03	Russian Grand Prix: Lewis Hamilton closes in on world title after team orders hand him win over Sebastian Vettel	Ruski Grand Prix: Lewis Hamilton bliži se tituli svjetskog prvaka nakon što su mu timske naredbe omogućile pobjedu nad Sebastianom Vettelom
independent.226349	st03	It became clear from the moment that Valtteri Bottas qualified ahead of Lewis Hamilton on Saturday that Mercedes" team orders would play a large part in the race.	Čim se Valtteri Bottas u subotu kvalificirao ispred Lewisa Hamiltona, postalo je jasno da će naredbe Mercedesova tima odigrati veliku ulogu u utrci.
independent.226349	st03	From pole, Bottas got a good start and almost hung Hamilton out to dry as he defended his position in the first two turns and invited Vettel to attack his teammate.	Bottas je imao dobar početak iz pol pozicije i gotovo da je ostavio Hamiltona na cjedilu dok je branio svoju poziciju u prva dva zavoja i pozvao Vettela da napadne njegova suigrača.
independent.226349	st03	Vettel went into the pits first and left Hamilton to run into the traffic at the tail of the pack, something which should have been decisive.	Vettel je otišao u boks prvi i ostavio Hamiltona da upadne u gužvu na kraju grupe, nešto što je trebalo biti presudno.
independent.226349	st03	The Mercedes pitted a lap later and came out behind Vettel, but Hamilton went ahead after some wheel-to-wheel action that saw the Ferrari driver reluctantly leave the inside free at risk of holding out after a double-move to defend on the third corner.	Mercedes je idući krug ušao u boks te izišao iza Vettela, ali Hamilton ga je prestigao nakon vožnje rame uz rame u kojoj je vozač Ferrarija nerado napustio unutrašnju stranu s rizikom da neće izdržati dvostruki potez radi obrane pozicije na trećem zavoju.
independent.226349	st03	Max Verstappen started from the back row of the grid and was in seventh by the end of the first lap on his 21st birthday.	Max Verstappen krenuo je sa stražnjeg reda startne rešetke i završio na sedmome mjestu na kraju prvog kruga na svoj 21. rođendan.
independent.226349	st03	He then led for a large part of the race as he held onto his tyres to target a quick finish and overtake Kimi Raikkonen for fourth.	Zatim je vodio većim dijelom utrke te je ubrzao kako bi što prije došao do cilja i pretekao Kimija Raikkonena za četvrto mjesto.
independent.226349	st03	He eventually came into the pits on the 44th lap but was unable to increase his pace in the remaining eight laps as Raikkonen took fourth.	U konačnici je ušao u boks u 44. krugu, ali nije mogao povećati svoju brzinu u preostalih osam krugova dok je Raikkonen zauzeo četvrto mjesto.
independent.226349	st03	It's a difficult day because Valtteri did a fantastic job all weekend and was a real gentleman told let me by.	Ovo je težak dan zato što je Valtteri odradio odličan posao cijeli vikend i bio pravi gospodin.
independent.226349	st03	The team have done such an exceptional job to have a one two," said Hamilton.	"Tim je odradio izuzetno dobar posao kako bi uzeo prvo i drugo mjesto”, izjavio je Hamilton.
kcal.279	st04	Father Remains Hopeful That Suspect Who Fatally Shot Son One Year Ago Will Be Caught	Otac još uvijek vjeruje da će osumnjičeni koji mu je prije godinu dana upucao sina biti uhvaćen
kcal.279	st04	It's been one year since a 20-year-old from Long Beach was fatally shot, but the victim's family isn't giving up hope that the shooter will be caught.	Prošla je godina dana otkad je 20-godišnjak iz Long Beacha ubijen, ali njegova obitelj ne gubi nadu i vjeruje da će ubojica biti uhvaćen.
kcal.279	st04	"I wish I could trade places with you son, I wish I could trade places with you," Guy Alford, the victim's father, said.	"Kad bi samo mogao biti na tvom mjestu, sine, kad bi samo mogao biti na tvom mjestu", rekao je Guy Alford, žrtvin otac.
kcal.279	st04	Alford came back to the scene of the crime exactly one year after his son, Guy Alford III, was gunned down at a Jack In The Box near 52nd and Atlantic. He said he wanted to call attention to his son's unsolved murder.	Alford se vratio na mjesto zločina točno godinu dana nakon što je njegov sin, Guy Alford III, upucan u restoranu brze hrane na križanju 52. ulice i avenije Atlantic. Rekao je da želi skrenuti pozornost na neriješeno ubojstvo svoga sina.
kcal.279	st04	"Somebody knows something, they need to say something," he said.	"Ako netko nešto zna, mora to reći", rekao je.
kcal.279	st04	Security video, which has never been released, showed Alford stopped in the drive-thru when a second car pulled up behind him. Three suspects were then seen getting out of that car. One of them walked up to the driver's side, and shot Alford. The four people in Alford's car jumped out and ran. The suspects were then seen getting back into their car and driving away.	Snimka nadzornih kamera, koja nikad nije objavljena, pokazuje da je Alford stajao u drive-thru prolazu kad je drugi automobil stao iza njega. Tri osumnjičenika su zatim izašla iz automobila. Jedan od njih došao je do vozačeve strane i upucao Alforda. Četvero ljudi u Alfordovom automobilu istrčali su iz auta i pobjegli. Osumnjičenici su se zatim vratili u automobil i odvezli dalje.
kcal.279	st04	"Wherever this coward is, he will get caught," Alford said.	"Gdje god da se nalazi ta kukavica, bit će uhvaćen", rekao je Alford.
kcal.279	st04	This grieving father said he has no idea who would want to hurt his son, and he said he still didn't know who was in the car with him when he was shot.	Tugujući otac rekao je da nema pojma tko bi želio nauditi njegovom sinu, kao i da još uvijek ne zna tko je bio s njim u automobilu kad je upucan.
kcal.279	st04	"They upped and ran out of my son's car like that, where did you run to," Alford said. "Did you go back and try to help him or what? Nobody said nothing."	"Iznenada su samo tako istrčali iz sinovog automobila, gdje ste pobjegli", rekao je Alford. "Jeste li se vratili i pokušali mu pomoći ili što već? Nitko ništa nije rekao".
kcal.279	st04	Alford said his son was a star football player at Alemany High School, then a stand-out safety on the Long Beach City College football team. Alford said his son was working toward playing for a Division 1 school and had dreams of becoming a nurse.	Alford kaže da je njegov sin bio najbolji igrač američkog nogometa srednje škole Alemany, a zatim istaknuti safety u momčadi Long Beach City Collegea. Alford kaže da je njegov sin bio na putu da zaigra za školu koja se natječe u prvoj diviziji te da je sanjao da će postati medicinski tehničar.
kcal.279	st04	"He was working three jobs," Michael Harvey, a friend, said. "As somebody who's 21, he was a year younger than me, anybody with that type of hustle and work ethic, you tend to look up to."	"Imao je tri posla", rekao je njegov prijatelj Michael Harvey. "Kao 21-godišnjak, bio je godinu mlađi od mene, ugledaš se na bilo koga tko je tako marljiv i ima takvu radnu etiku". 
kcal.279	st04	As the investigation into the fatal shooting continues, Alford said he wasn't giving up either.	Dok se nastavlja istraga ove smrtonosne pucnjave, Alford kaže da ni on ne odustaje.
kcal.279	st04	"I can assure you, this one is going to get solved," he said.	"Uvjeravam vas, ovo će se riješiti", rekao je.
kcal.279	st04	Alford is personally offering a $2,000 reward for information that leads to an arrest and conviction. Anyone with information about this crime is urged to call Long Beach police.	Alford osobno nudi nagradu od 2000 funti za informacije koje bi dovele do uhićenja i presude. Upućuju se svi koji imaju informacije o ovom zločinu da se jave policiji u Long Beachu.   
nytimes.184804	st05	U.S. Weighed Penalizing El Salvador Over Support for China, Then Backed Off	SAD razmišljao o kažnjavanju El Salvadora zbog potpore Kini, a onda odustao 
nytimes.184804	st05	Diplomats noted that the Dominican Republic and Panama had already recognized Beijing, with little pushback from Washington.	Diplomati su primjetili da su Dominikanska Republika i Panama već priznale Beijing, s negodovanjem iz Washingtona. 
nytimes.184804	st05	Mr. Trump had a warm meeting with President Juan Carlos Varela of Panama in June 2017 and had a hotel in Panama until partners evicted the Trump Organization's management team.	Trump je imao ugodan sastanak s panamskim predsjednikom Juanom Carlosom Varelom u lipnju 2017., a imao je i hotel u Panami sve dok partneri nisu izbacili Trumpov upravljački tim.
nytimes.184804	st05	State Department officials decided to call back the American chiefs of diplomatic missions from El Salvador, the Dominican Republic and Panama over the "recent decisions to no longer recognize Taiwan," Heather Nauert, the department's spokeswoman, said in a statement early this month.	Dužnosnici Ministarstva vanjskih poslova odlučili su pozvati američke šefove diplomatskih misija iz El Salvadora, Dominikanske Republike i Paname zbog "nedavnih odluka da se Tajvan više ne prizna", izjavila je početkom ovog mjeseca Heather Nauert, glasnogovornica ministarstva.
nytimes.184804	st05	But penalties were only considered against El Salvador, which received an estimated $140 million in American aid in 2017, including for narcotics controls, development and economic support.	Međutim, razmišljalo se samo o kažnjavanju El Salvadora, koji je 2017. primio oko 140 milijuna dolara pomoći iz SAD-a, uključujući za kontrolu narkotika, razvoj i ekonomsku potporu.
