review_cd+vinyl_110_1	st19	HA!	HA!
review_cd+vinyl_110_1	st19	Go to AMAZON UK and get the complete 13-disc set in a beautiful box set for about $84 shipped.	Idite na AmazonUK i kupite potpuni set od 13 diskova u prekrasnom box setu, koji će vam se dostaviti a oko 84 dolara.
review_cd+vinyl_110_1	st19	(I just received mine!	(Ja sam svoj upravo kupio!)
review_cd+vinyl_110_1	st19	)It doesn't take Marvin, with a brain the size of a planet, to see which is better.	Ne moraš biti Marvin i imati mozak veličine planeta da bi skužio koja je opcija bolja.
review_cd+vinyl_113_2	st20	Original Audio CD Verison Still Available	Originalna Audio CD verzija još je dostupna
review_cd+vinyl_113_2	st20	With regard to concerns about the audio quality of the this MP3 version, the original audio CD version ("The Collector's Edition"), an 8-CD set, is still available from Amazon UK.	U vezi zabrinutosti o kvaliteti zvuka ove MP3 verzije, originala audio CD verzija („The Collector's Edition“), set od 8 CD-ova još je dostupan na Amazon UK.
review_cd+vinyl_113_2	st20	I paid a little more than twice the MP3 price.	Platio sam malo više od dvostruke cijene MP3-a.
review_cd+vinyl_113_2	st20	The ISBN number of the Audio CD version is 0-563-47702-4.	ISBN broj audio CD verzije je 0-563-47702-4.
review_cd+vinyl_12_5	st01	Keith Green - Relevant for the Ages	Keith Green - Relevantan za sva vremena
review_cd+vinyl_12_5	st01	Though it has been over 3 decades since Keith left this life, his music still resonates with truth.	Iako su prošla tri desetljeća otkako je Keith otišao s ovog svijeta, njegova glazba još uvijek odzvanja istinom.
review_cd+vinyl_12_5	st01	This was one of the first albums I purchased of Keith's &#34;back in the day&#34;.	Ovo je bio jedan od prvih Keithovih albuma koje sam nekada kupio.
review_cd+vinyl_12_5	st01	What a sweet album of praise as he moves through the Psalms!	Kakav krasan album pun slave dok prolazi kroz psalme!
review_cd+vinyl_152_2	st02	NOT CLAPTION MUSIC VIDEO!  A Learn How To Play Guitar LIKE Clapton	NIJE CLAPTION GLAZBENI VIDEO! Video da naučiš svirati gitaru kao Clapton
review_cd+vinyl_152_2	st02	I bought this DVD and I'm returning it.	Kupio sam ovaj DVD i sad ga vraćam.
review_cd+vinyl_152_2	st02	The description and editorial review are misleading.	Opis i recenzija su pogrešni. 
review_cd+vinyl_152_2	st02	This is NOT a Clapton video.	Ovo NIJE Clapton video.
review_cd+vinyl_152_2	st02	Certainly some clips from Clapton, but generally this is a "how to" video.	Definitivno sadrži neke videoisječke Claptona, ali je ovo generalno "how to" video.
review_cd+vinyl_152_2	st02	Same applies to Clapton  The Early Years!	Isto vrijedi i za Claptonove The Early Years!
review_cd+vinyl_156_2	st03	NOT CLAPTION MUSIC VIDEO!  A Learn How To Play Guitar LIKE Clapton	NIJE CLAPTONOV GLAZBENI SPOT! Priručnik kako svirati gitaru POPUT Claptona
review_cd+vinyl_156_2	st03	I bought this DVD and I'm returning it.	Kupio sam ovaj DVD, a sada ga vraćam.
review_cd+vinyl_156_2	st03	The description and editorial review are misleading.	Opis i urednička recenzija proizvoda obmanjuju.
review_cd+vinyl_156_2	st03	This is NOT a Clapton video.	Ovo NIJE Claptonov video.
review_cd+vinyl_156_2	st03	Certainly some clips from Clapton, but generally this is a "how to" video.	Sigurno ima neke klipove Claptona, ali ovo je općenito priručnik.
review_cd+vinyl_156_2	st03	Also applies to Clapton The Solo Years.	Isto vrijedi i za Clapton The Solo Years.
review_cd+vinyl_159_2	st04	Don't waste your money.	Nemojte bezveze trošiti novac.
review_cd+vinyl_159_2	st04	This isn't worth your money.	Ovo ne vrijedi toliko.
review_cd+vinyl_159_2	st04	Doug runs through each song in about three or four minutes, he doesn't give you time to learn it.Unless you've already mastered transcribing (and then why buy this dvd?	Doug za tri-četiri minute prođe kroz svaku pjesmu, ne daje vam vremena da pjesmu naučite.Osim ako ste već svladali transkripciju (ali zašto biste onda kupili ovaj dvd?
review_cd+vinyl_159_2	st04	), you're going to be left to rewinding a million times to get the right notes.This is no better than a youtube video of someone playing a bunch of clapton songs.Doug doesn't even show you the rhythm or other guitar parts!	), morat ćete milijun puta vraćati pjesmu na početak da biste uhvatili točne note.Ovo nije ništa bolje od nekoga tko u YouTube videu svira hrpu Claptonovih pjesama. Doug čak ne pokaže ni ritam ni druge gitarske dionice! 
review_cd+vinyl_159_2	st04	You're left only knowing the lead!What sense does that make?	Naučite samo vodeću! Kakvog to smisla ima?
review_cd+vinyl_164_1	st05	Clapton Classics	Claptonovi klasici
review_cd+vinyl_164_1	st05	Very disappointing.	Iznimno razočaravajuće.
review_cd+vinyl_164_1	st05	This was advertised to be a "note-for-note" lesson on selected Clapton tunes, and it was not even close.	Ovo je bilo reklamirano kao "nota-po-nota" podučavanje o odabranim Claptonovim pjesmama, ali nije bilo ni blizu tome. 
review_cd+vinyl_164_1	st05	There was no tab to support the little (and sometime inaccurate) portions of the songs that were listed.	Nije bilo unosa za male (a ponekad i netočne) dijelove pjesama koje su bile na popisu.
review_cd+vinyl_164_1	st05	I sent a complaint directly to Hal Leonard, but never received the courtesy of a reply.	Uložio sam žalbu izravno Hal Leonardu, ali nikad nisam dobio odgovor. 
review_cd+vinyl_16_5	st06	Fave!	Jedna od najdražih!
review_cd+vinyl_16_5	st06	I bought this in LP form when it was brand new, recorded it onto a cassette so I could play it in my car, listened, and listened, and listened.	Kupio sam je u obliku gramofonske ploče kad je bila potpuno nova i presnimio na kasetu kako bih je mogao slušati u autu iznova i iznova.
review_cd+vinyl_16_5	st06	I have so missed listening to this (no longer have a turn-table) that I've finally reordered it on CD.	Tako mi je nedostajalo slušati je (naime, više ne posjedujem gramofon) da sam je konačno presnimio na CD.
review_cd+vinyl_16_5	st06	YAY!!	Jupi!!
review_cd+vinyl_16_5	st06	Can't wait to play it, and play it, and play it.	Jedva čekam da ju puštam opet i opet i opet.
review_cd+vinyl_16_5	st06	No one, absolutely no one wears his heart for God on his sleeve like Keith Green!	Nitko, apsolutno nitko ne pokazuje svoje emocije prema Bogu kao Keith Green!
review_cd+vinyl_16_5	st06	I can't wait to meet him in heaven.	Jedva čekam da ga upoznam u raju.
review_cd+vinyl_17_5	st07	Anointed!	Pomazan!
review_cd+vinyl_17_5	st07	I love the songs on this album and how Keith once again focuses all on the Good Shepherd, our Lord Jesus.	Sviđaju mi se pjesme na ovom albumu i kako Keith ponovno sve usredotočuje na Dobrog pastira, našeg Gospodina Isusa.
review_cd+vinyl_17_5	st07	The songs are timeless, the anointing is fresh even after all the years since they were written.	Pjesme su bezvremenske, pomazanje je svježe čak nakon svih godina nakon što je napisano.
review_cd+vinyl_17_5	st07	I think that's a sure sign of anointing is to see the fruit remain.	Mislim da je pravi znak pomazanja vidjeti njegove plodove.
review_cd+vinyl_23_5	st08	Wonderful!!!	﻿Predivno!!!
review_cd+vinyl_23_5	st08	I had had a cassette of this recording, and knew I loved it.	Imao/la sam kasetu s ovom snimkom i znao/la sam da mi se sviđa.
review_cd+vinyl_23_5	st08	I bought several of these CDs so that I could share with nephews, and friends, and keep one for myself.	Kupio/la sam nekoliko ovih CD-a kako bih ih mogao/la podijeliti nećacima i prijateljima, a jedan zadržati za sebe.
review_cd+vinyl_23_5	st08	Very gentle and easy to sleep to.	Vrlo nježno i lagano za ugodan san.
review_cd+vinyl_23_5	st08	Words are clearly sung, understandable.	Riječi su jasno i razumljivo otpjevane.
review_cd+vinyl_23_5	st08	It's been a blessing to me that I was anxious to find and pass on to others.	Blagoslovljen/a sam što sam ih uspjela pronaći i proslijediti drugima.
review_cd+vinyl_23_5	st08	Great for children-- I was a child when Grandma got me the tape.	Izvrsno za djecu…Bilo/a sam samo dijete kad mi je baka nabavila kasetu.
review_cd+vinyl_25_5	st14	Memories	﻿Uspomene
review_cd+vinyl_25_5	st14	My mother-in-law bought this video for my daughter when she was young.	Moja je punica kupila ovaj video mojoj kćeri kad je bila mala.
review_cd+vinyl_25_5	st14	I was looking for videos the other day for my three year old granddaughter and came across this.	Neki dan sam tražila videe za moju trogodišnju unuku i naišla sam na ovo.
review_cd+vinyl_25_5	st14	My granddaughter LOVES this video.	Moja unuka OBOŽAVA ovaj video.
review_cd+vinyl_25_5	st14	She watches it OVER and OVER and OVER.	Ne može ga prestati gledati.
review_cd+vinyl_25_5	st14	It is older, dated and corny, but she loves it!	Star je, staromodan i otrcan, ali ona ga obožava!
review_cd+vinyl_25_5	st14	We even find ourselves singing the songs!	Čak pjevamo i pjesme!
review_cd+vinyl_7_5	st10	His last album is focused on Praise	Njegov je posljednji album usredotočen je na Slavu
review_cd+vinyl_7_5	st10	Keith Green / Songs for the Shepherd:  His previous albums were more focused on encouragement and correction towards the Church.	Keith Green/Songs for the Shepherd: Prethodni albumi stavljali su veći naglasak na poticanje odlaska u Crkvu i uzornije ponašanje. 
review_cd+vinyl_7_5	st10	This, his last, is focused on Praise.	Ovaj je posljednji album usredotočen na Slavu. 
review_cd+vinyl_7_5	st10	This one is still not as great as his first album, but it is a strong enough Praise album to earn Five Stars.	Ovaj album nije toliko dobar koliko i prvi, no dovoljno je dobar da dobije pet zvjezdica.
review_cd+vinyl_8_5	st11	This is album is absolutely Blessed!	Bog blagoslovio ovu ploču!
review_cd+vinyl_8_5	st11	As soon as it reached me, I played and listened to it and I had a flashback moment to the eighties when I heard it and when I saw him in concert just before his death.	Čim sam ju dobila, pustila sam ju i odslušala, vratilo me u osamdesete kad sam ju prvi put čula i kad sam ga vidjela uživo netom prije nego što je preminuo.
review_cd+vinyl_8_5	st11	I wept but smiled because I was soo blessed by the music and I hope you are encourage to get this as well.	Plakala sam, ali sa smiješkom jer sam se osjećala blagoslovljeno od glazbe. Nadam se da će vas to potaknuti da si i sami ovo nabavite.
review_cell-phones+accessories_102_1	st12	FAIL	KATASTROFA
review_cell-phones+accessories_102_1	st12	JUNK!!	SMEĆE!!
review_cell-phones+accessories_102_1	st12	!......This product must be miss labeled.	!......Ovaj proizvod sigurno je krivo označen.
review_cell-phones+accessories_102_1	st12	I can not get my Samsung S2 phone to charge with this OEM charger.	Ne mogu napuniti svoj Samsung S2 ovim originalnim punjačem.
review_cell-phones+accessories_102_1	st12	The lights are on, the phone says its charging but nothing happens.	Svjetlo je upaljeno i na mobitelu piše da se puni, ali ništa se ne događa.
review_cell-phones+accessories_102_1	st12	I am not sure if I got a defective product but it is very upsetting to sit in your car for hours and not see your phone recharge.	Ne znam zasigurno je li mi poslan defektan proizvod, ali jako je frustrirajuće satima sjediti u autu i gledati kako se mobitel ne puni.
review_cell-phones+accessories_102_1	st12	If you need a reliable charger, DO NOT purchase this product.If you need a car charger for your Samsung S2, I would recommend the Motorola Vehicle Power Adapter.	Ako vam treba pouzdan punjač, NEMOJTE kupiti ovaj proizvod.Ako vam treba auto punjač za Samsung S2, preporučujem Motorolin strujni adapter za vozila.
review_cell-phones+accessories_102_1	st12	It charges fast and is dependable.	Brzo puni i pouzdan je.
review_cell-phones+accessories_105_2	st13	LIGHT DUTY FAILURE	JEFTINI PROMAŠAJ
review_cell-phones+accessories_105_2	st13	WHAT A GREAT PRICE!RIGHT OUT OF THE BOX, PLUG N UPLOAD SUM JUICE ...DON'T KNOW IF DROPPING IT REPEATEDLY ON THE FLOORBOARD,OR OCCASIONALLY STUFFING IT IN CONSOLE TO HIDE CAUSED FAILURE ...BUT SOON THE GREEN LIGHT FAILED TO LIGHT, AND PHONES DISPLAY SHOWEDIT WASN'T CHARGING.	KAKVA SJAJNA CIJENA!RAVNO IZ KUTIJE, SAMO GA UŠTEKAJTE I PUNJENJE POČINJE ...NE ZNAM JE LI TO ZBOG TOGA ŠTO MI JE VIŠE PUTA PAO NA POD ILI ŠTO SAM GA GURAO U KONZOLU KAKO BIH SAKRIO KVAR ...NO ZELENO SE SVJETLO UBRZO VIŠE NIJE PALILO, A ZASLON MOBITELA NIJE PRIKAZIVAO DA SE PUNI.
review_cell-phones+accessories_105_2	st13	SO EITHER SPEND SEVERAL MORE DOLLARS FOR ONE WITHA HEAVIER CORD/STRONGER SHELL OR TREAT IT AS A DELICATE FLOWER.	ZATO ILI POTROŠITE PAR DOLARA VIŠE NA PUNJAČ S DEBLJIM KABLOM/ČVRŠĆOM KUTIJOM ILI S NJIME POSTUPAJTE KAO S NJEŽNIM CVIJETOM.
review_cell-phones+accessories_117_1	st14	Stopped Working after 1 1/2 month..	﻿Prestao je raditi nakon jednog i pol mjeseca.
review_cell-phones+accessories_117_1	st14	This thing worked well when it actually functioned, but today it stopped working and I am past the 30 day return window by 10 days give or take.I'm guessing the quality might not be great as that is why it stopped working, who knows.. What a waste of money.	Ova stvarčica bila je dobra dok je zapravo funkcionirala, ali danas je prestala raditi, a razdoblje za povrat od 30 dana prošlo je prije nekih 10 dana. Pretpostavljam da kvaliteta možda nije najbolja, budući da je zato prestao raditi, tko zna... Šteta novca.
review_cell-phones+accessories_12_5	st07	A Winner	Pobjednik
review_cell-phones+accessories_12_5	st07	This is the first battery case I have had for my Galaxy S4.	Ovo mi je prva maska s baterijom otkad imam Galaxy S4.
review_cell-phones+accessories_12_5	st07	The S4 fits very well, is slim and doesn't add much weight to the Galaxy S4.	Dobro pristaje mojoj S četvorci, tanka je i ne daje puno na težini Galaxy S četvorci.
review_cell-phones+accessories_12_5	st07	It doubles the battery life.	Povećava vijek trajanja baterije za duplo.
review_cell-phones+accessories_12_5	st07	You can charge either the battery, the phone or both.	Možete puniti bateriju, mobitel ili oboje.
review_cell-phones+accessories_12_5	st07	There is a handy on-off switch with leds to indicate the level of charge.The battery case came on time and was packaged well.	Ima i zgodan prekidač s led lampicama koje pokazuju razinu napunjenosti. Maska s baterijom došla je na vrijeme i bila je dobro zapakirana.
review_cell-phones+accessories_12_5	st07	Well worth the price.	Vrijedi svake lipe.
review_cell-phones+accessories_127_1	st16	Unfortunate item.	﻿Nezgodni artikl. 
review_cell-phones+accessories_127_1	st16	I received this product in a very timely manner which was delightful, however, I gave it as a gift and was embarrassed to find out it was a defective item.	Zaprimila sam ovaj proizvod na vrijeme, što je bilo sjajno. Međutim, poklonila sam ga i bilo mi je neugodno kad sam otkrila da je bio neispravan. 
review_cell-phones+accessories_127_1	st16	I was reimbursed for the product but would have much rather had a product that worked the first time.	Dobila sam povrat novaca za njega, ali bilo bi mi draže da sam dobila proizvod koji je radio isprve.
review_cell-phones+accessories_132_1	st17	Not Very Good!	Nije baš nešto!
review_cell-phones+accessories_132_1	st17	Had all the marking of a legit samsung product but the cord stop working after 3 days.	Proizvod je imao sve oznake pravog samsungovog proizvoda, ali je kabel prestao raditi nakon 3 dana.
review_cell-phones+accessories_132_1	st17	I'm not upset because it was very inexpensive but maybe you should spend a little more and buy a better product off amazon.	Nisam ljut jer je bilo dosta jeftino, ali bi možda bila dobra ideja da potrošite malo više i kupite bolji proizvod s amazona.
review_cell-phones+accessories_132_1	st17	When it did work it worked very well.	Dok je radio, radio je dobro.
review_cell-phones+accessories_13_5	st18	Absolutely love the case !!	﻿Oduševljena sam ovom maskicom! 
review_cell-phones+accessories_13_5	st18	Performs exactly as advertised .	Ista je kao i na reklami.
review_cell-phones+accessories_13_5	st18	It's very  sturdily built,and provides lots of boost .	Solidno je napravljena i ima odličnu podršku.
review_cell-phones+accessories_13_5	st18	It does exactly what it's supposed too .Easy to insert phone in and out .	Radi upravo ono za što je namijenjena. Jednostavna je za umetanje i vađenje mobitela.
review_cell-phones+accessories_13_5	st18	Definitely a 5 star experience.	Definitivno iskustvo koje zaslužuje 5 zvjezdica.
review_cell-phones+accessories_13_5	st18	Don't know what I would do without this case LOVE LOVE LOVE it.	Ne znam što bih bez ove maskice – O-BO-ŽA-VAM ju.
review_cell-phones+accessories_25_4	st19	Works great	Super radi. 
review_cell-phones+accessories_25_4	st19	I have several chargers.	Imam nekoliko punjača. 
review_cell-phones+accessories_25_4	st19	Have more than one vehicle so I keep more than one of these in each.	Imam više vozila i svaki punjač držim u jednom. 
review_cell-phones+accessories_25_4	st19	Nothing more frustrating than finding all of a sudden one quits working, and you have no way to recharge your phone.	Nema ništa gore nego kad odjedanput shvatiš da ti punjač ne radi i ne možeš napuniti mobitel . 
review_cell-phones+accessories_25_4	st19	That is always when you need it most.	To se uvijek dogodi kad ti mobitel hitno treba. 
review_cell-phones+accessories_25_4	st19	This one works well for any of my products.	Ovaj se slaže sa svim mojim spravama. 
review_cell-phones+accessories_28_4	st20	Solid Charger but RF noisy	Solidan punjač ali RF je glasna
review_cell-phones+accessories_28_4	st20	This is a nice charger but you can tell it was made cheaply in China.	Dobar je punjač ali jasno je da je napravljen jeftino u Kini.
review_cell-phones+accessories_28_4	st20	When it is charging the phone, the car radio gets LOTS of static.	Kad puni mobitel radio u autu prima DOSTA smetnje.
review_cell-phones+accessories_28_4	st20	Not so much that I have to stop charging but like when you are near power lines and the radio station is far away.So, no RF shielding.I gave it 4 stars because it works fine for me, but if you listen to the radio, you might consider it is more like 2 or 3 stars.	Ne toliko da bih isključio s punjenja nego ono kad si blizu dalekovoda, a radio postaja je daleko.Dakle, nema zaštite za RF. Dao sam 4 zvjezdice jer mi dobro funkcionira, ali ako slušate radio možda biste mogli smatrati da je bliže 2 ili 3 zvjezdice.
review_cell-phones+accessories_40_4	st01	Dual USB Port Car Charger	USB auto punjač s dva ulaza
review_cell-phones+accessories_40_4	st01	Purchased product about many a month ago.	Kupio proizvod davnih dana.
review_cell-phones+accessories_40_4	st01	Pros: Loved it work just fine!!	Za: Svidio mi se skroz dobro radi!!
review_cell-phones+accessories_40_4	st01	Cool Blue light feature when you plug it into the lighter!!	Fora plava svjetlost kada ga uključiš.
review_cell-phones+accessories_40_4	st01	Can plug in two things at one time....Con: Top clear piece came off easily overtime (I just put clear tape around the top) TOTAL: PROS:95% CONS:5%	Može se uključiti u dvije stvari odjednom...Protiv: Prozirni dio na vrhu se s vremenom lako otkinuo (ja sam samo stavio prozirnu vrpcu oko vrha) UKUPNO: ZA:95% PROTIV:5%
review_cell-phones+accessories_4_4	st10	Cute!	Fora!
review_cell-phones+accessories_4_4	st10	Item arrived in great time and was in perfect condition.	Pošiljka je stigla baš na vrijeme i bez greške.
review_cell-phones+accessories_4_4	st10	However, I ordered these buttons because they were a great deal and included a FREE screen protector.	Međutim, ove sam tipke naručila jer su bile baš super stvar i zato što se uz njih dobije BESPLATNA zaštita za zaslon.
review_cell-phones+accessories_4_4	st10	I never received one.	Nikada ju nisam dobila.
review_cell-phones+accessories_4_4	st10	Though its not a big deal, it would've been nice to get it since they claim it comes with one.	Nije sad to neki big deal, no bilo bi lijepo da ju dobijem kad već piše da dolazi u paketu. 
review_cell-phones+accessories_47_1	st03	Be careful	Budite oprezni
review_cell-phones+accessories_47_1	st03	I bought 2 of this and tried to test first ... after few minutes of charging, it felt hot.	Kupio sam dva primjerka i pokušao isprobati jedan od njih... Nakon nekoliko minuta punjenja, bio je vruć na dodir.
review_cell-phones+accessories_47_1	st03	Pulled it out and the product smelled burnt.	Izvukao sam ga iz struje i proizvod je mirisao kao da je izgorio.
review_cell-phones+accessories_47_1	st03	Tried the other one too and same thing.	Pokušao sam i s drugim, ista stvar.
review_cell-phones+accessories_47_1	st03	Be careful... this one could be fire hazard or could potentially destroy the electrical system	Budite oprezni... Ovo bi moglo biti lako zapaljivo ili potencijalno uništiti električni sustav.
review_cell-phones+accessories_57_5	st04	Perfect!	Savršeno!
review_cell-phones+accessories_57_5	st04	I was worried about this order because the picture on the description page kept changing to a less-desireable green/orange cover.	Brinula sam se zbog ove narudžbe jer se slika na opisnoj stranici promijenila u manje poželjnu zeleno-narančastu maskicu.
review_cell-phones+accessories_57_5	st04	But alas, it came a day earlier than expected, and the beautiful pink product expected!	Ali srećom došla je dan ranije od predviđenog i u ružičastoj boji kao što sam očekivala.
review_cell-phones+accessories_57_5	st04	The "rubberized" cover feels a little greasy (like it was armor-all'd), but the design is gorgeous and a little 3D looking!	Na dodir se "gumeni" dio čini malo mastan (kao da je premazan armor-allom), ali dizajn je predivan i izgleda pomalo kao 3D.
review_cell-phones+accessories_64_2	st05	Loved it at first	Isprva mi se svidjela
review_cell-phones+accessories_64_2	st05	I loved the case when I first received it but shortly after, the case started to peel off at first i did not know what it was until i looked on the back of the case and it was missing spots.	Svidjela mi se maskica kad sam je tek dobio, no ubrzo nakon toga počela se ljuštiti, isprva nisam znao o čemu je riječ dok nisam pogledao stražnji dio maskice te su pojedini dijelovi nedostajai.
review_cell-phones+accessories_64_2	st05	Guess sometimes a good deal is not really a good deal.would not purchase.	Izgleda da ponekad dobra ponuda i nije toliko dobra. Ne bih je više kupio. 
review_grocery+gourmet-food_11_5	st06	Amazing!	Fantastično!
review_grocery+gourmet-food_11_5	st06	I ordered these in Summer so they of course arrived melted, a trip the freezer made them awesome again though.	Naručio/la sam ih po ljetu tako da su, logično, stigle otopljenje, ali čim su stavljene u zamrzivač opet su postale sjajne.
review_grocery+gourmet-food_11_5	st06	Just order them in cooler times of the year and you should get them in good condition.I love these so much more than the regular chocolate Kit-Kat bars.	Upravo sam ih ponovo naručio/la sad kad je hladnije vrijeme i trebao/la bih ih dobiti u dobrom stanju. Ove su mi toliko draže od običnih Kit-Kat čokoladica.
review_grocery+gourmet-food_11_5	st06	I hope some day to see them on store shelves in the US some day.	Nadam se da će ih jednog dana staviti na police trgovina u SAD-u.
review_grocery+gourmet-food_13_5	st07	Thank goodness they are expensive	Hvala nebesima da su skupi
review_grocery+gourmet-food_13_5	st07	Yes - this is one of the most expensive candies around, because it only comes imported.	Da - ovo su jedni od najskupljih slatkiša zato što se samo mogu uvesti.
review_grocery+gourmet-food_13_5	st07	But my goodness - are these ever good.	Ali, ajme meni - kako su dobri.
review_grocery+gourmet-food_13_5	st07	The KitKat folks could really clean up if they started selling these in the US.	Ljudi koji rade za Kit Kat stvarno bi mogli zaraditi da ih počnu prodavati u SAD-u.
review_grocery+gourmet-food_13_5	st07	Once you try them you can't wait for more.	Jednom kad ih probate, ne možete dočekati još.
review_grocery+gourmet-food_13_5	st07	So yummy and delivered quickly and fresh.	Vrlo ukusni i dostavljeni brzo i svježi.
review_grocery+gourmet-food_147_2	st08	Cinnamon Licorice powder	﻿Cinnamon Licorice Powder (Cimet sladić u prahu)
review_grocery+gourmet-food_147_2	st08	this stuff is a poor example of an authentic 5-spice powder which I paid $1.5 for 4oz locally, despite the fact that other Dynasty products are useful such as their Satay sauce.	Ovo je loš primjer autentičnog praha od 5 začina koji sam lokalno platio/la 1,5$ za 4 unca, unatoč činjenici da su drugi Dynasty proizvodi korisni, kao primjerice njihov Satay umak. 
review_grocery+gourmet-food_147_2	st08	I live walking distance to Flushing Queens, and have a good idea what it's supposed to taste like from authentic Asian cooking sold nearby.	Živim nedaleko Flushing Queensa i upoznat/a sam s time kakav bi trebao biti okus autentičnog azijskog kuhanja. 
review_grocery+gourmet-food_147_2	st08	If you want to go cheap off Amazon, you are better off withFrontier Five Spice Powder, 1.92-Ounce Bottle.	Ako želite proći jeftino s Amazonom, najbolje vam je odabrati Frontier Five Spice Powder, bocu od 1,92 unci. 
review_grocery+gourmet-food_147_2	st08	BTW "star anise" or "aniseed" is already a licorice flavor, so to add even more licorice to this bottle was foolish.	Usput, „zvjezdani anis” ili „anis” već ima okus sladića, pa je dodavanje još više sladića bilo nepotrebno.
review_grocery+gourmet-food_16_4	st09	Not enough Matcha tea flavor for me ... (=_=)	Matcha čaj se ne osjeća dovoljno po mom ukusu... (=_=)
