review_musical-instruments_18_5	st08	I know it will perform...as for Sam Ash ...this cord was packed in a mailer inside another box with my Roc n Soc... his shipping team do great work..never any complaints from me...	Znam da će poslužiti svrsi…što se tiče trgovine Sam Ash….ovaj je kabel bio spakiran u pošiljci unutar jedne druge kutije s mojim Roc-N-Soc stolcem… tim za otpremu radi sjajan posao…nikad nemam primjedbi…
review_musical-instruments_18_5	st08	I love Sam Ash.. thanks Amazon	Volim Sam Ash… hvala Amazon
review_musical-instruments_24_5	st09	Quality cable!	Kvalitetan kabel!
review_musical-instruments_24_5	st09	Got this cable to run a rockband keyboard controller to my M-audio profire 2626 to control midi in Pro Tools.	Kupio sam ovaj kabel da spojim Rock Band klavijature sa svojom M-audio Profire 2626 zvučnom karticom da mogu koristiti MIDI u Pro Toolsu.
review_musical-instruments_24_5	st09	Works great!	Super radi!
review_musical-instruments_24_5	st09	Firm fit, solidly molded ends, reputable branded cable.	Čvrsto pristaje, krajevi su učvršćeni, a kabel je od renomiranog proizvođača.
review_musical-instruments_24_5	st09	(a bit on the thin side, but i haven't seen to have any issue due to this or anything.	(malo je tanak, ali nisam s time imao nekih problema niti išta.
review_musical-instruments_24_5	st09	Couldn't go wrong for $5 at the time of my purchase and prime eligibility.	Nisam mogao fulati s obzirom na to da je bio 5$ kad sam ga kupovao, a bila je dostupna i Amazon Prime opcija.
review_musical-instruments_25_5	st10	I Got Great Pricing, But Still a Really Good Product	Dobio sam stvarno dobar proizvod po prihvatljivoj cijeni
review_musical-instruments_25_5	st10	When I was searching for MIDI cables for my ART X-15 foot controller, I came across these Hosa ones, and they were $2 dollars each!	Kada sam tražio MIDI kabele za ART X-15 nožni kontroler, naišao sam na Hosa kablove, i komad je koštao 2 dolara!
review_musical-instruments_25_5	st10	As they are now $6, I realize I would still be happy with that price as well, as they are high quality plastic and metal connectors, and work flawlessly.	Sad je komad 6 dolara, no platio bih i toliko jer se radi o visokokvalitetnim plastičnim i metalnim konektorima koji rade besprijekorno.
review_musical-instruments_25_5	st10	You must realize that they are only 5 feet, as I overestimated it and now wish they were longer.	Imajte na umu da su dugački samo metar i pol, malo sam ih precijenio, bilo bi bolje da su duži. 
review_musical-instruments_25_5	st10	For any connection from racked sound modules, this will be perfect.	Bit će savršeni za bilo koju vezu iz zvučnih modula s reckom.
review_musical-instruments_287_2	st12	It's OK but I wish I'd bought something else.	U redu je, ali bio bih zadovoljniji da sam kupio nešto drugo.
review_musical-instruments_287_2	st12	The handle and spring strength make this uncomfortable to place on the guitar, and I feel rushed to clamp on the capo because it's unpleasant to use - hurts the fingers.	Zbog ručke i snažne opruge ovaj je kapodaster neugodno namjestiti na gitaru te ga žurim zakvačiti jer ga je neudobno držati u ruci – pritišće prste.
review_musical-instruments_287_2	st12	It's cheap and easy to use.	Jeftin je i jednostavan za uporabu.
review_musical-instruments_287_2	st12	It'll do the job, but I don't like it.	Služi svojoj svrsi, ali ne sviđa mi se.
review_musical-instruments_3_5	st13	It Does The Job Well	Dobro obavlja svoju zadaću
review_musical-instruments_3_5	st13	The primary job of this device is to block the breath that would otherwise produce a popping sound, while allowing your voice to pass through with no noticeable reduction of volume or high frequencies.	Glavna je zadaća ove naprave prigušiti dah koji bi u suprotnom stvorio zvuk pucketanja te istovremeno propustiti vaš glas bez primjetnog stišavanja zvuka ili visokih frekvencija.
review_musical-instruments_3_5	st13	The double cloth filter blocks the pops and lets the voice through with no coloration.	Dvostruki filter napravljen od tkanine prigušuje pucketanje te propušta glas bez obojenosti.
review_musical-instruments_3_5	st13	The metal clamp mount attaches to the mike stand secure enough to keep it attached.	Stalak s metalnom sponom dovoljno se dobro može prikvačiti na postolje za mikrofon da ostane pričvršćen.
review_musical-instruments_3_5	st13	The goose neck needs a little coaxing to stay where you put it.	Savitljivom držaču treba mali poticaj da ostane gdje ga postavite.
review_musical-instruments_409_1	st14	It distorts	﻿Distorzira
review_musical-instruments_409_1	st14	This is a cheap piece of junk that does what it says, it distorts, You want something to make your guitar sound like junk, this will do it.	Ovo je jeftino smeće koje radi ono što i obećaje, distorzira, Ako želite nešto od čega će vam gitara zvučati kao smeće, ovo je pravi proizvod za vas.
review_musical-instruments_409_1	st14	Why pedals that make your guitar sound like a piece of junk are the most popular is beyond me.	Nemam pojma zašto su pedale od kojih vam gitara zvuči kao zadnje smeće najpopularnije.
review_musical-instruments_409_1	st14	This is not a boutique Distortion pedal like Hendrix would use.	Ovo nije butikna pedala za distorziju kakvu bi koristio Hendrix.
review_musical-instruments_409_1	st14	Boutique and distortion are an oxymoron.These things are built with heavy metal, it should last, I kinda hope it doesn't(just kidding), you want distortion, you got distortion	Butikno i distorzija je oksimoron. Ove stvari se rade od teških metala, trebale bi trajati, nekako se nadam da neće (šala), željeli ste distorziju, to ste i dobili
review_musical-instruments_414_1	st15	Beginners Beware	﻿Početnici budite na oprezu
review_musical-instruments_414_1	st15	Here's the deal with this pedal.	Evo u čemu je stvar s ovom papučicom.
review_musical-instruments_414_1	st15	It is inexpensive and you can get a better pedal with barely a bit more money and sometimes a little less money.	Jeftina je, a možete nabaviti bolju papučicu za nešto malo više novaca ili ponekad čak i manje novaca.
review_musical-instruments_414_1	st15	In my opinion, for spending less than $100 for a distortion pedal, whether it is your first pedal or 700th pedal, a few more bucks will get you the MXR Badass distortion which has a much crisper tone to it.	Po mom mišljenju, kada se radi o plaćanju manje od 100 dolara za papučicu za distorzije, bila to vaša prva ili 700. papučica, par dolara više će vam osigurati distorziju MXR Badassa koji ima puno čišći zvuk.
review_musical-instruments_483_2	st16	Dunlop The Original CryBaby Pedal	﻿Dunlop Original Cry Baby pedala
review_musical-instruments_483_2	st16	If you want your guitar to sound like Eddie Van Halen, Joe Satriani and other guitarists studio album guitar sound, then get a BOSS GT-10 (guitar multi effects processor) and install BOSS GT-10 Patches by James Limborg.	Ako želiš da ti gitara ima zvuk poput gitara Eddieja Van Halena, Joeja Satrianija i drugih gitarista s njihovih studijskih albuma, nabavi BOSS GT-10 (gitarski multi-efekt procesor) i instaliraj BOSS GT-10 Patches Jamesa Limborga. 
review_musical-instruments_483_2	st16	Search Google for BOSS GT-10 Patches by James Limborg.	Pretraži na Googleu BOSS GT-10 Patches Jamesa Limborga.
review_musical-instruments_51_2	st17	Cannot recommend	Ne preporučam
review_musical-instruments_51_2	st17	I didn't expect this cable to be so thin.	Nisam očekivao da će kabel biti toliko tanak.
review_musical-instruments_51_2	st17	It's easily 1/2 the thickness of any guitar cable I've used.	Sigurno je upola tanji od bilo kojeg kabela za gitaru koji sam dosad koristio.
review_musical-instruments_51_2	st17	Not sure about long-term durability or signal loss/interference.	Nisam siguran koliko će dugo potrajati ili izgubiti signal/imati smetnje.
review_musical-instruments_51_2	st17	If I had the foresight I'd spend a couple extra bucks on a thicker cable.	Da sam to znao prije, bio bih kupio deblji kabel za par dolara više.
review_musical-instruments_51_2	st17	Still, it works and was inexpensive.EDIT: 6 months later and it's dead already.	Unatoč svemu, radi i bio je jeftin.IZMJENA: prošlo je 6 mjeseci i već ne radi.
review_musical-instruments_51_2	st17	Wire frayed at the right angle jack.	Žica se izlizala na desnom kutnom priključku.
review_musical-instruments_51_2	st17	You get what you pay for.	Koliko para, toliko muzike.
review_musical-instruments_53_1	st18	I have bought many cables and this one is the only one that gives me problems	﻿Kupio sam puno kabela i ovaj je jedini koji mi zadaje probleme. 
review_musical-instruments_53_1	st18	It hums, crackles, and I think I'm having problems with my equipment.	Zuji i pucketa, a mislim da imam problema i s ostatkom opreme.
review_musical-instruments_53_1	st18	As soon as I use any of my other cords then the problem is gone.	Čim koristim neki drugi kabel, problem nestane.
review_musical-instruments_53_1	st18	Hosa makes some other products that have good value.	„Hosa“ ima neke druge proizvode koji su zbilja dobre kvalitete.
review_musical-instruments_53_1	st18	But based on my experience I don't recommend this one.	No iz svog iskustva ne preporučam ovaj proizvod.
review_musical-instruments_547_2	st19	Too Big.	﻿Preveliko.
review_musical-instruments_547_2	st19	Sorry, I don't like these as they're just too big.	Nažalost, ova oprema  mi se ne sviđa jer je prevelika.
review_musical-instruments_547_2	st19	They stand out too much.	Previše upada u oči.
review_musical-instruments_547_2	st19	They do work and they're effective but they are too pronounced.	Rade i učinkoviti su ali su prenaglašeni.
review_musical-instruments_547_2	st19	There are many good alternatives; strap gaskets, strap locks, undoing the pin and putting it straight into the guitar strap.	Ima puno dobrih alternativa: brtve, strap lockovi, skidanje gumba i privezivanje gitare za remen
review_musical-instruments_547_2	st19	Again, they work, but they're not aesthetic nor elegant.	 Opet, djeluje, ali nije estetski privlačna ni elegantna,
review_musical-instruments_547_2	st19	I also got a gold set for my bass and now it looks like I should be wearing big purple platforms when I play.	Kupio sam i zlatni set za bas i imam osjećaj da bih trebao nositi velike ljubičaste platform cipele dok sviram.
review_musical-instruments_547_2	st19	Not cool.	To nije kul.
review_patio+lawn+garden_10_4	st20	Flexible hose as marketed....hope it lives up to the hipe!	Savitljivo crijevo kao što je i naznačeno….nadam se da neće razočarati!
review_patio+lawn+garden_10_4	st20	So far so good!	Za sada je dobro!
review_patio+lawn+garden_10_4	st20	I have not really had the time to test out the hose as it is cold weather time right now.	Nisam imao baš prilike iskušati crijevo budući da je sada hladno vrijeme.
review_patio+lawn+garden_10_4	st20	I bought this Gilmour hose based on all the recommendations.	Kupio sam ovo Gilmour crijevo zbog svih preporuka.
review_patio+lawn+garden_10_4	st20	I am looking forward to not having to wrestle the hose to use it.	Radujem se što se više neću morati boriti s crijevom kako bih ga mogao koristiti.
review_patio+lawn+garden_11_4	st01	have you changed the rubber formula ????	jeste li promijenili formulu za gumu ????
review_patio+lawn+garden_11_4	st01	Hey Gilmore I have been buying your hoses for years and only your hoses.	Pozdrav Gilmore već godinama kupujem vaša crijeva i samo vaša.
review_patio+lawn+garden_11_4	st01	You stand behind your product and provide great customer support..	Stojite iza svog proizvoda i pružate odličnu potporu za kupce..
review_patio+lawn+garden_11_4	st01	But I am only giving you 4 stars  because this hose and the 100 footer I bought  a few months back seem to kink more than my older Flexogens not sure why ?	Ali dajem vam samo 4 zvjezdice jer se čini da se ovo crijevo i ono od 30 metara koje sam kupila prije nekoliko mjeseci uvijaju više od mojih starih Flexogenovih ne znam zašto?
review_patio+lawn+garden_14_5	st03	Just as hoped	Baš kao što sam se nadao
review_patio+lawn+garden_14_5	st03	I was worried about getting a short one, but this serves my need just fine, as it accompanied by a longer and more troublesome one.	Brinuo sam se da ću si nabaviti prekratko crijevo, ali ovo služi mojim potrebama sasvim u redu jer uz njega dolazi i veće crijevo, koje je problematičnije.
review_patio+lawn+garden_14_5	st03	I leave the sprinkler on it instead of switching heads - so much easier.	Ostavljam prskalice na njemu umjesto da zamijenim glave. Puno je jednostavnije.
review_patio+lawn+garden_14_5	st03	slightly stiff to lay out, but if it weren't, I am sure it would kink.	Malo je teže raširiti ga, ali da nije, siguran sam da bi se dalo saviti.
review_patio+lawn+garden_14_5	st03	I got it with the gilmore brass 2-way hose connector - an excellent pair for me	Uz njega sam kupio i Gilmour dvosmjerni priključak za crijevo od mjeda. Ispostavilo se kao odlična kombinacija za mene. 
review_patio+lawn+garden_147_2	st05	Had to return...	Morao sam ih vratiti...
review_patio+lawn+garden_147_2	st05	This pruner does not even remotely cut 1&#34; branches, wet or dry.	Ove škare ni približno ne režu granje, bilo mokro ili suho. 
review_patio+lawn+garden_147_2	st05	Does not cut 3/4&#34; branches.	Ne reže granje. 
review_patio+lawn+garden_147_2	st05	It may cut SOME 1/2&#34; dry branches but at least the one I received was not sharpened and I was forced to return it.	Možda čak i reže poneko suho granje, ali ove koje sam ja dobio nisu bile naoštrene i bio sam prisiljen vratiti ih.
review_patio+lawn+garden_147_2	st05	Have not decided on a new one yet, since I was so disappointed after reading all the great feedbacks and finding different.	Nisam se još odlučio na kupnju novih, s obzirom na to da sam bio jako razočaran nakon što sam pročitao recenzije i dobio drukčije informacije.
review_patio+lawn+garden_1_4	st06	Great Hoses	Veličanstveno crijevo
review_patio+lawn+garden_1_4	st06	Good USA company that stands behind their products.	Dobra američka firma koja stoji iza svojih proizvoda.
review_patio+lawn+garden_1_4	st06	I have had to warranty two hoses and they send replacements right out to you.	Morao sam vratiti i pokazati garanciju za dva crijeva i odmah su mi poslali zamjenska.
review_patio+lawn+garden_1_4	st06	I had one burst after awhile, you could see it buldge for weeks before it went so no suprises.	Jedno je puklo nakon nekog vremena, ali je imalo napuhnute dijelove po sebi tjednima prije puknuća pa tu nije bilo nikakvih iznenađenja.
review_patio+lawn+garden_1_4	st06	The other one was winter related as I am bad and leave them out most of the time.	Drugo sam crijevo morao vratiti zbog zime jer sam zaboravan i većinu ih vremena ostavim vani.
review_patio+lawn+garden_1_4	st06	Highly reccomend.	Zaista sve preporuke.
review_patio+lawn+garden_1_4	st06	Note the hundred footer is heavy and like wresting an anaconda when its time to put away, but it does have a far reach.	Samo zapamtite da je crijevo od 30 metara teško i imate osjećaj da se hrvate s anakondom kad ga treba spremiti, ali zaista seže daleko.
review_patio+lawn+garden_15_5	st07	Gilmour makes great products	Gilmour pravi sjajne proizvode
review_patio+lawn+garden_15_5	st07	For everything I need for my lawn and garden work I try to find a Gilmour product.	Sve što trebam za svoj travnjak i rad u vrtu pokušavam naći među Gilmourovim proizvodima.
review_patio+lawn+garden_15_5	st07	They just can't be beat for the price and/or guarantee.	Jednostavno im nema ravnih po cijeni i/ili jamstvu.
review_patio+lawn+garden_15_5	st07	This hose is typical of a Gilmour item.	Ovo je crijevo klasičan Gilmourov proizvod.
review_patio+lawn+garden_15_5	st07	It is a strong and supple hose and like most other Gilmour products, comes with a lifetime guarantee.	Snažno je i savitljivo crijevo i kao većina drugih Gilmourovih proizvoda dolazi s doživotnim jamstvom.
review_patio+lawn+garden_15_5	st07	I have cut hoses with my mower and they still replace them.	Zarezao sam crijeva kosilicom i svejedno su ih zamijenili. 
review_patio+lawn+garden_15_5	st07	Quite a company!	Kakva tvrtka!
review_patio+lawn+garden_161_2	st09	Not For Hills	Nije za padine
review_patio+lawn+garden_161_2	st09	I'm not sure how I missed that important point, but I did.	Nisam siguran kako mi je taj bitni dio promaknuo, ali je.
review_patio+lawn+garden_161_2	st09	I don't see that clearly mentioned from scott's, either.	Ne vidim ni da je to posebno istaknuto na Scottsovim stranicama.
review_patio+lawn+garden_161_2	st09	This particular model with the four wheels makes it nearly impossible to use on hills.	Baš ovaj model s četiri kotača čini upotrebu ove kosilice na padinama gotovo nemogućom.
review_patio+lawn+garden_161_2	st09	It just doesn't have the leverage to cut the grass.	Jednostavno nema dovoljno snage da posjeće travu.
review_patio+lawn+garden_161_2	st09	So I'm back to the mower.	Tako da sam se vratio običnoj kosilici.
review_patio+lawn+garden_161_2	st09	One thing I will say is that it cuts well on flat surfaces, but it does require a bit more effort than I thought to push.	Ali reći ću da dobro kosi travu na ravnim površinama, no zahtjeva nešto više napora za guranje nego što sam očekivao.
review_patio+lawn+garden_181_2	st10	Don't buy if your lawn is larger than 10 sq yards	Ne kupujte ovo ako je vaš travnjak veći od 10 kvadratnih metara
review_patio+lawn+garden_181_2	st10	Couldm't cut my grass very well.	Nisam mogao dobro kositi.
review_patio+lawn+garden_181_2	st10	Misses some spots because it just didn't cut it.	Fula neka mjesta jer jednostavno ne kosi svugdje.
review_patio+lawn+garden_181_2	st10	if the grass is taller than 2 inches, this is not mower for you.	Ako je trava viša od 5 centimetara, ovo nije kosilica za vas.
review_patio+lawn+garden_181_2	st10	Need to spend the money and get something that works.	Za potrošeni novac trebate dobiti dobru stvar.
review_patio+lawn+garden_19_5	st12	Gilmour 8-ply Flexogen Hose 25 Foot	Gilmour Flexogen vrtno crijevo, 8 slojeva, 25 stopa 
review_patio+lawn+garden_19_5	st12	This little hose was purchased to add on to my other 50 foot hose due to the very humid and oppressive weather this last month in the Northeast.	Ovo malo crijevo kupio sam kako bih ga dodao svome crijevu od 50 stopa zbog jako vlažnog i sparnog vremena koje smo u mom kraju imali prošlog mjeseca.
review_patio+lawn+garden_19_5	st12	It is very flexible and easy to handle and allows me total reach of the back perennial garden.	Jako je fleksibilno i jednostavno za uporabu te njime mogu dosegnuti i vrt iza svoje kuće.    
review_patio+lawn+garden_19_5	st12	i would recommend this hose	Preporučio bih ovo crijevo  
review_patio+lawn+garden_247_1	st13	Kinked hose with vinyl separating - Returned!	Zapetljano vrtno crijevo čiji se vinil odvaja - Vraćeno!
review_patio+lawn+garden_247_1	st13	I read the other reviewers who had similar problems before I bought this.	Prije nego što sam ovo kupio pročitao sam komentare ostalih recenzenata koji su imali slične probleme.
review_patio+lawn+garden_247_1	st13	I also read the reviews raving about this hose.	Pročitao sam i recenzije u kojima su hvalili ovo crijevo.
review_patio+lawn+garden_247_1	st13	Since these hoses are maid from remnants; I suppose its a matter of luck as to which hose you get.	Budući da su ova crijeva napravljena od ostataka; pretpostavljam da moraš imati sreće da dobiješ dobro crijevo.
review_patio+lawn+garden_247_1	st13	My luck wasn't good.	Ja je nisam imao.
review_patio+lawn+garden_247_1	st13	The hose had permanent kinks and the vinyl skin had bubbles where it was separating from the hose.Returned it immediately.	Crijevo je imalo trajne petlje, a na koži vinila su na mjestima gdje se odvajala od crijeva bili mjehurići.Odmah sam ga vratio.
review_patio+lawn+garden_334_1	st14	Useless trap, horrible design	﻿Beskorisna zamka, grozan dizajn
review_patio+lawn+garden_334_1	st14	The coons steal the bait from this trap at will.	Mačke kradu mamce iz ove zamke kad god požele.
review_patio+lawn+garden_334_1	st14	I've had to re-engineer the trigger to even trip as a bowling ball rolled into it wouldn't engage the trip at first.	Morala sam prepraviti okidač da se uopće pokrene budući da ga isprva kotrljanje kugle za kuglanje prema njemu ne bi pokrenulo.
review_patio+lawn+garden_334_1	st14	They advise putting bait past trip plate, but the coons just reach through the mesh and get the bait, another serious design flaw.	Savjetuju stavljanje mamca iza ploče koja aktivira zamku, ali mačke jednostavno posegnu kroz mrežu i uzmu mamac, što je još jedna velika mana dizajna.
review_patio+lawn+garden_334_1	st14	There are traps that work, this just in NOT one of those.	Mnoge zamke funkcioniraju, ovo jednostavno NIJE jedna od njih.
review_patio+lawn+garden_334_1	st14	Save your money!	Ne trošite novac na nju!
review_patio+lawn+garden_387_1	st15	Two different ones broke	﻿Dvoje različitih se potrgalo
review_patio+lawn+garden_387_1	st15	The pruner will not release easily if you grab hold of a branch a little too thick, and at five feet away it's not always the easiest thing to do to notice if that branch is an 1/8th inch too thick.	Ove škare za obrezivanje ne popuštaju lako ako zahvatite malo predebelu granu, a kada ste metar i pol udaljeni od nje nije lako primijetiti da je grana 20 cm predebela.
review_patio+lawn+garden_387_1	st15	As a result, it broke on the second day.	Zbog toga su se potrgale drugi dan otkako sam ih dobio.
review_patio+lawn+garden_387_1	st15	Amazon replaced with another, which broke due to same issue, but this time was too late to return.	Amazon mi je poslao zamjenske, koje su se potrgale iz istog razloga, ali ovog puta bilo je prekasno za povrat.
review_patio+lawn+garden_387_1	st15	I bought another, more expensive one that I am happy with and I would recommend it to anyone else: ARS LA-180ZR203 4-to-7-Feet Long Reach Pruner	Kupio sam druge, skuplje škare s kojima sam zadovoljan i preporučio bi ih svakome: ARS LA-180ZR203 Škare za obrezivanje dosega od 120 do 210 cm
review_patio+lawn+garden_392_1	st11	Not for bushes	Nije za grmove
review_patio+lawn+garden_392_1	st11	I have a large piece of property in Arizona that requires the removal of bushes from time to time and I figured this looked like the perfect tool to cut the main trunk/branches of a dessert bush; NOT!!!!	Posjedujem veliko zemljište u Arizoni na kojemu je potrebno s vremena na vrijeme uklanjati grmove i ovo mi se činio kao savršen alat za ukloniti glavno korijenje/grane pustinjskog drača; IPAK NIJE!!!!!
review_patio+lawn+garden_392_1	st11	!It was worth a try, but it is clumsy and will not cut through most of the fibrous shoots of a typical desert bush.	Vrijedilo je pokušati, ali nezgrapno je i ne reže kroz veći dio vlaknastih žila tipičnog pustinjskog drača.
review_patio+lawn+garden_392_1	st11	I am back to the pick and spade.I have many tools for tree limbs that do a much better job than this.I'll give it to my brother.	Vraćam se motiki i lopati. Imam mnogo alata za micanje grana koji su puno bolji od ovoga. Dat ću ovo bratu.
review_patio+lawn+garden_392_1	st11	:>)Note: My rating is strictly for the said application.	:>) Opaska: Ocjena vrijedi samo za navedenu primjenu.
review_patio+lawn+garden_6_5	st17	GGGGGGGGREAT	OOOOOOODLIČNO
review_patio+lawn+garden_6_5	st17	I aqm impressed with the cost and quality of this product, Also impressed on the fast shipment by Amazon as I received it in 4 days, Has not kinked and a great hose as I had one before which I left in the yard during all seasons and even ran across driveway, But it lasted 5 good years through all the abuse,  I would recommend this to anyone, Thanks	Oduševljen sam cijenom i kvalitetom ovog proizvoda, Također sam oduševljen brzom dostavom od Amazona jer sam dobio paket unutar četiri dana, ne petlja se i odlično je crijevo kao jedno crijevo što sam imao u dvorištu tijekom cijele godine i čak je bilo rastegnuto preko prilaza, Ali izdržalo je 5 godina maltretiranja, Preporučio bih ovo svakome, Hvala
review_pet_supplies_131_2	st18	DVD for Cats	﻿DVD za mačke
review_pet_supplies_131_2	st18	Purchased this cat DVD for our active cat.	Kupio sam ovaj DVD o mačkama za svog živahnog mačka.
review_pet_supplies_131_2	st18	Hoping that it would keep his attention long enough to give me a break from playing with him.	Nadao smo se da će mu odvući pažnju dovoljno dugo da se odmorim od igre s njim.
review_pet_supplies_131_2	st18	I have to say that the first DVD is the only one that captures his attention for about 10-20 minutes.	Moram reći da da mu jedino prvi DVD odvuće pažnju na 10-20 minuta.
review_pet_supplies_131_2	st18	The other DVD's he doesn't even look at.	Druge DVD-e uopće ne gleda.
review_pet_supplies_131_2	st18	Maybe I just have a cat that is just too active to sit still...I don't know.	Možda samo imam mačka koji je preenergičan da bi sjedio na miru. . . Ne znam.
review_pet_supplies_131_2	st18	I would recommend the first DVD only if you are thinking of trying it.	Ako mislite ovo probati, preporučio bih samo prvi DVD.
review_pet_supplies_131_2	st18	Great price and fast delivery.	Odlična cijena i brza dostava,
review_pet_supplies_132_2	st19	Waste of money.	Bačen novac 
review_pet_supplies_132_2	st19	This is the same DVD series someone had given me back in 2007 and it stinks.	Ovo su isti DVD-ovi koje mi je netko dao još 2007. i ništa ne valjaju. 
review_pet_supplies_132_2	st19	The camera moves too much, jerking around and I could have made a better video using my cell phone.	Kamera se previše miče i trza. Bolji sam video mogla snimit na mobitelu. 
